{
  "version": 1,
  "runtimeVersion": "0.1.10",
  "protocolVersion": "0.6.0",
  "instanceId": "11111111-1111-4111-8111-111111111111",
  "pid": 4242,
  "startedAt": "2026-08-04T00:00:00.000Z",
  "dataDirectory": "/home/example/.local/share/otelux",
  "databasePath": "/home/example/.local/share/otelux/otelux.db",
  "mcpTokenFile": "/home/example/.local/share/otelux/mcp-token",
  "receiver": {
    "kind": "running",
    "host": "127.0.0.1",
    "port": 4318,
    "pressure": {
      "overloadedTraces": 0,
      "overloadedLogs": 0,
      "overloadedMetrics": 0
    }
  },
  "mcp": {
    "kind": "running",
    "host": "127.0.0.1",
    "port": 4320
  }
}
